{
  "schema_version": "0.2.0",
  "run_id": "fixture-a31-score",
  "stage": "evaluation",
  "started_at": "2026-09-03T10:00:00Z",
  "finished_at": "2026-09-03T10:01:00Z",
  "git_commit": "1111111111111111111111111111111111111111",
  "dirty_worktree": false,
  "config_sha256": "sha256:2222222222222222222222222222222222222222222222222222222222222222",
  "model_id": "Qwen/Qwen2.5-Coder-7B",
  "model_revision": "0396a76181e127dfc13e5c5ec48a8cee09938b02",
  "model_config_sha256": "sha256:3333333333333333333333333333333333333333333333333333333333333333",
  "adapter_sha256": null,
  "dataset_manifest_sha256": "sha256:4444444444444444444444444444444444444444444444444444444444444444",
  "environment_sha256": "sha256:5555555555555555555555555555555555555555555555555555555555555555",
  "seed": 20260830,
  "slurm_job_id": "93799",
  "prediction_artifact_sha256": "sha256:6666666666666666666666666666666666666666666666666666666666666666",
  "execution_artifact_sha256": "sha256:7777777777777777777777777777777777777777777777777777777777777777",
  "source_inference_git_commit": "8888888888888888888888888888888888888888",
  "source_inference_config_sha256": "sha256:9999999999999999999999999999999999999999999999999999999999999999",
  "scoring_protocol_version": "a3-scoring-v2",
  "scoring_config_sha256": "sha256:2222222222222222222222222222222222222222222222222222222222222222",
  "summary_artifact_sha256": "sha256:aaaaaaaaaaaaaaaaaaaaaaaaaaaaaaaaaaaaaaaaaaaaaaaaaaaaaaaaaaaaaaaa",
  "notes": "A3.1 terminal-LF-normalized evaluation of immutable source predictions."
}
